{
  "$schema": "./schema.json",
  "name": "headless_stack_metrics",
  "runs": 2,
  "command": {
    "windows": [
      ".\\build\\Release\\fullphysics_headless.exe",
      "--demo",
      "1",
      "--steps",
      "900",
      "--dt",
      "0.016666667",
      "--wind-x",
      "0.5",
      "--gravity-scale",
      "1.0",
      "--csv",
      "artifacts/headless_stack_metrics.csv",
      "--snapshot-out",
      "artifacts/headless_stack_metrics.fp2snap"
    ],
    "default": [
      "./build/fullphysics_headless",
      "--demo",
      "1",
      "--steps",
      "900",
      "--dt",
      "0.016666667",
      "--wind-x",
      "0.5",
      "--gravity-scale",
      "1.0",
      "--csv",
      "artifacts/headless_stack_metrics.csv",
      "--snapshot-out",
      "artifacts/headless_stack_metrics.fp2snap"
    ]
  },
  "notes": "Headless stack run exporting metrics CSV and final snapshot."
}
