{
  "$schema": "./schema.json",
  "name": "headless_revolute_motor",
  "runs": 2,
  "command": {
    "windows": [
      ".\\build\\Release\\fullphysics_headless.exe",
      "--demo",
      "3",
      "--steps",
      "1200",
      "--dt",
      "0.008333333",
      "--wind-x",
      "1.0",
      "--gravity-scale",
      "1.0",
      "--csv",
      "artifacts/headless_revolute_motor.csv"
    ],
    "default": [
      "./build/fullphysics_headless",
      "--demo",
      "3",
      "--steps",
      "1200",
      "--dt",
      "0.008333333",
      "--wind-x",
      "1.0",
      "--gravity-scale",
      "1.0",
      "--csv",
      "artifacts/headless_revolute_motor.csv"
    ]
  },
  "notes": "Higher-rate headless run intended for motorized constraint stress observations."
}
